title,url,author,date,excerpt
IRI and U. of Arizona Team Up for Climate,https://iri.columbia.edu/news/iri-and-u-of-arizona-team-up-for-climate/,IRI,5/22/14,"IRI and the University of Arizona address climate vulnerability in most at-risk areas of the world in new project The Caribbean, Asia’s Indo-Gangetic Plain and West Africa are three regions known to be extremely vulnerable to climate variability and change, particularly to droughts, extreme weather events and stresses on food production, water resources and coastal areas. A [&hellip;]"
Online Crop Calendar Helps Indonesian Government Manage Climate Risk,https://iri.columbia.edu/news/online-cropping-calendar-helps-government-manage-climate-risk-indonesia/,Elisabeth Gawthrop,3/31/14,"The International Research Institute for Climate and Society and the Center on Globalization and Sustainable Development at Columbia University are collaborating with the Centre for Climate Risk and Opportunity Management in Southeast Asia Pacific at Institut Pertanian Bogor (IPB &#8211; Bogor Agriculture University) in Indonesia to help farmers cope with droughts, fires and other climate impacts. The project, called “CU-IPB [&hellip;]"
"Insuring 37,000 Rwandan Farmers Against Drought",https://iri.columbia.edu/news/insuring-37000-rwandan-farmers-against-drought/,Francesco Fiondella,8/22/13,"Index insurance can lower the cost of insurance, allowing smallholder farmers to buy insurance that can help them withstand the impacts of bad years and risk making productive investments in good years. A key component of index insurance is historical data – often temperature or rainfall data – to use as a basis for creating an index that determines when insurance payouts [&hellip;]"
An Index Insurance Primer,https://iri.columbia.edu/news/an-index-insurance-primer-2/,Francesco Fiondella,8/16/13,"IRI has put together a list of Frequently Asked Questions for the US Agency for International Development about index insurance and how it is being used in development and adaptation projects around the world. Download the FAQ or click on the image. If you&#8217;re looking for even more resources on index insurance, head over to our Financial [&hellip;]"
Poor Ethiopian Farmers Receive &#8220;Unprecedented&#8221; Insurance Payout,https://iri.columbia.edu/news/poor-ethiopian-farmers-receive-unprecedented-insurance-payout/,Brian Kahn,12/12/12,"Oxfam America and The Rockefeller Foundation announced a weather index insurance payout of unprecedented scale directly to poor farmers. Thanks to a groundbreaking new program that relies on advanced satellite technology, more than 12,200 farmers in 45 villages in Northern Ethiopia will benefit from drought protection. As a result of this year&#8217;s drought conditions each [&hellip;]"
"Breaking the Poverty Trap in Ethiopia: Subsistence, Satellites, and Some Other Important Stuff",https://iri.columbia.edu/news/breaking-the-poverty-trap-in-ethiopia-subsistence-satellites-and-some-other-important-stuff-2/,Brian Kahn,8/29/12,"Subsistence Two acres of cracked earth. In northern Ethiopia, it can be a trap that keeps farmers tethered to it for generations. Or it can be a springboard to a better life for this and future generations. What impedes it from showing its springier qualities? You could argue the biggest pressure on the land comes [&hellip;]"
A model for improving climate services in Africa,https://iri.columbia.edu/news/a-model-for-improving-climate-services-in-africa/,Francesco Fiondella,2/1/12,"In developed countries, we are accustomed to having access to long and detailed records on weather and climate conditions, demographics, disease incidence and many other types of data. Decision makers use this information for a variety of societal benefits: they spot trends, fine-tune public health systems and optimize crop yields, for example. Researchers use it [&hellip;]"
Insuring Against Drought,https://iri.columbia.edu/news/insuring-against-drought/,Francesco Fiondella,9/2/11,"In our latest video interview, research economist Dan Osgood discusses index insurance and how it is helping some poor rural communities reduce hardships caused by drought in East Africa: These products are becoming available to people for the first time at larges scales just this year. Given the difficulties of these [two] years, the farmers [&hellip;]"
Leaders in index insurance expand their commitments in Ethiopia,https://iri.columbia.edu/news/leaders-in-index-insurance-expand-their-commitments-in-ethiopia/,Francesco Fiondella,9/28/09,"Swiss Re, Oxfam America, The Rockefeller Foundation and Columbia University&#8217;s International Research Institute for Climate and Society announced a joint Commitment to Action at the Clinton Global Initiative 2009 meeting in New York, held from September 22 to 25. The collaboration is aimed at helping communities most vulnerable to climate variability and change. It will [&hellip;]"
Index insurance for development and disaster management,https://iri.columbia.edu/news/index-insurance-for-development-and-disaster-management/,IRI,6/24/09,"Para Espanol: Seguro &#8216;parametrico&#8217; y reduccion de la pobreza Pour Francais: Une assurance particuliere pour la gestion des risques climatiques Climate has always presented a challenge to farmers, herders, fishermen and others whose livelihoods are closely linked to their environment, particularly those in poor areas of the world. A type of insurance called index insurance [&hellip;]"