title,url,author,date,excerpt
Integrating Satellite Data with Local Knowledge for Community Empowerment,https://iri.columbia.edu/news/integrating-satellite-data-with-local-knowledge-for-community-empowerment/,IRI,5/13/24,"Original post published on the&nbsp;SERVIR news site iKON: A Game-Changer for Pastoralists in Senegal A new wave of African researchers is embracing transformative opportunities through the Small Innovation Grants Program (SIGP), implemented by SERVIR West Africa (SERVIR WA), a joint project between&nbsp;USAID&nbsp;and&nbsp;NASA,&nbsp;in partnership with&nbsp;ICRISAT,&nbsp;Manobi Africa&nbsp;and&nbsp;AIMS. Over the past two years, SIGP has served as a [&hellip;]"
Celebrating Women in Science: Sari Blakeley,https://iri.columbia.edu/news/celebrating-women-in-science-sari-blakeley/,IRI,2/15/24,"Adapted from a story written by Olga Rukovets for the State of the Planet news site. Sari Blakeley did not always dream of a career in science. In fact, when she was younger, her understanding of “science” always involved “people in lab coats pipetting liquids over a Bunsen burner.” Over time, her perspective on science [&hellip;]"
Crowdsourcing to Build Better Insurance,https://iri.columbia.edu/news/crowdsourcing-insurance/,Francesco Fiondella,4/7/22,"In order to offer protective insurance to even greater numbers of smallholder farmers, in 2021 ACToday began testing mobile crowdsourcing apps that tap into the experiences and memories of farmers themselves."
IRI at COP26 &#8211; Mélody Braun on Why COP Matters,https://iri.columbia.edu/news/iri-at-cop26-melody-braun-on-why-cop-matters/,Brynne Wilcox,11/2/21,"The United Nations’ twenty-sixth Conference of the Parties, or COP26, is taking place in Glasgow, Scotland from October 30 to November 12. The COP is the largest and most important international meeting on climate change. The countries involved come together to make a number of crucial decisions to stabilize greenhouse gas emissions in order to [&hellip;]"
"In New Project, Millions of Farmers Will Help to Improve Insurance Against Climate Disasters",https://iri.columbia.edu/news/in-new-project-millions-of-farmers-will-help-to-improve-insurance-against-climate-disasters/,IRI,10/29/21,"This story was originally written by Kristin French and published on the State of the Planet blog. Megafires, extreme weather, locust swarms, pandemics: These are just some of the many natural disasters that have devastated farmers in recent years, destroying livelihoods and leaving hunger in their wake. Between 2008 and 2018, disasters cost the agricultural [&hellip;]"
Index Insurance for Madagascar’s Groundnut Farmers,https://iri.columbia.edu/news/index-insurance-for-madagascars-groundnut-farmers/,IRI,10/5/21,by Yohana Tesfamariam Tekeste and Souha Ouni Designing financial tools and processes that help farmers bounce back from droughts and other extreme weather events is a crucial part of their strategy to adapt to longer-term climate change. The Financial Instruments Sector Team (FISTeam) of the International Research Institute for Climate and Society has been an [&hellip;]
Insurance Tools for Climate Adaptation: Q&#038;A with Rahel Diro,https://iri.columbia.edu/news/insurance-tools-for-climate-adaptation-qa-with-rahel-diro/,Jacquelyn Turner,8/31/21,The world’s 570 million smallholder farmers are among the most vulnerable to the impacts of current and future climate variability and climate change. They need support and science-based strategies to make their communities resilient to these impacts and enable them to have sustainable livelihoods no matter what the climate might bring. One adaptation strategy being [&hellip;]
iKON: Playing to Adapt,https://iri.columbia.edu/news/ikon-playing-to-adapt/,IRI,8/5/21,"Climate risk instruments are designed to help farmers adapt to climate variability and change. These instruments are usually driven by data from satellites and weather stations, but these data sets can be improved over time using community-sourced observation data. Currently, such farmer data collection is limited to small-scale focus groups. However, increasing constraints on direct [&hellip;]"
2021 ACToday Highlight: Helping Provide Insurance to a Million Smallholder Farmers,https://iri.columbia.edu/news/2021-actoday-highlight-helping-provide-insurance-to-a-million-smallholder-farmers/,IRI,5/11/21,"This story was published as part of the Adapting Agriculture to Climate Today, for Tomorrow (ACToday) Columbia World Project 2021 Report. Read the full report here. Since its launch in 2017, ACToday has invested in forecasts, monitoring tools and other information products to help government agencies, humanitarian organizations and farmers better plan for droughts and [&hellip;]"
Improving Risk Indicators: Introducing the Next Generation Drought Index Project,https://iri.columbia.edu/news/improving-risk-indicators-introducing-the-next-generation-drought-index-project/,Jacquelyn Turner,3/11/21,"Across the globe, food security continues to be a significant challenge, one that is estimated to increase with the compounding factors of the COVID-19 pandemic and climate change. The Next Generation Drought Index (NGDI) project addresses this challenge by leveraging satellite technology and drought modeling to provide&nbsp;humanitarian and development agencies&nbsp;access to the latest and most [&hellip;]"
Climate Risk Insurance for Colombia&#8217;s Smallholder Rice Farmers,https://iri.columbia.edu/news/climate-risk-insurance-for-colombias-smallholder-rice-farmers/,Francesco Fiondella,5/29/20,"The Adapting Agriculture to Climate Today, for Tomorrow (ACToday) Columbia World Project has helped create advanced and sustainable climate services around the world tailored for agricultural decision making. Countries are using these new services to manage many of the climate-related risks to their food systems. But even the best climate services by themselves cannot manage [&hellip;]"
ACToday Experts Take Part in Panel on Climate and Food Security,https://iri.columbia.edu/news/actoday-experts-take-part-in-panel-on-climate-and-food-security/,IRI,5/18/20,"Adapted from a news story by Columbia World Projects. Scientists and other experts from the Adapting Agriculture to Climate Today, for Tomorrow (ACToday) Project, joined former New York Times journalist Andrew Revkin for an online web seminar on May 7 to discuss the intersection of food, climate and coronavirus. The event – “Feeding Humanity as [&hellip;]"
ACToday Columbia World Project enabling insurance to reach a million farmers in Ethiopia,https://iri.columbia.edu/news/actoday-enabling-insurance-to-reach-a-million-farmers-in-ethiopia/,Francesco Fiondella,4/7/20,"The Adapting Agriculture to Climate Today, for Tomorrow Columbia World Project (ACToday) has been working with its Ethiopian partners to create new climate tools for decision makers working in agriculture and food security. These investments are now directly enabling the World Food Programme (WFP) to reach its 2022 target of providing a million smallholder farmers in Ethiopia with affordable insurance against droughts and other climate risks."
IRI@AGU: Crossing the &#8216;Predictability Desert&#8217;,https://iri.columbia.edu/news/crossing-the-predictability-desert/,Jacquelyn Turner,12/9/19,"Until recently, predicting rainfall and temperature at the subseasonal timescale (i.e. between two weeks and three months) was considered impossible. That’s beginning to change, thanks to the efforts of IRI&#8217;s Andrew Robertson, the head of IRI&#8217;s climate group and co-chair of the steering group of the Subseasonal to Seasonal (S2S) Prediction Project. &nbsp;In the Q&amp;A [&hellip;]"
IRI@AGU: Schedule of Events 2019,https://iri.columbia.edu/news/iri-agu-2019/,Carla Pena Singson,12/4/19,"A range of IRI’s areas of expertise will be represented at this year’s annual meeting of the American Geophysical Union (AGU). Below is the schedule of IRI&#8217;s posters and presentations in sequential order. SUNDAY, DECEMBER 8 World Climate Research Programme 40th Anniversary Symposium Lisa Goddard WCRP is celebrating its 40th year of international climate science. We [&hellip;]"
IRI@AGU: Focusing on Floods,https://iri.columbia.edu/news/focusing-on-floods/,Jacquelyn Turner,12/3/19,"Often considered one of the most revolutionary technologies for climate research, remote sensing has the capacity to vastly improve the predictive strength of a wide variety of forecasting methodologies. &nbsp;However, this is still a rapidly-growing field and continuing to evaluate and cross-reference remote sensing data against other data-gathering methods is necessary to improve accuracy, a [&hellip;]"
ACToday Q&amp;A: J. Nicolás Hernandez-Aguilera on Coffee and Climate,https://iri.columbia.edu/news/actoday-nicolas-coffee-and-climate/,Carla Pena Singson,9/4/19,"IRI's Juan Nicolás Hernandez-Aguilera discusses his research on sustainable coffee production. Originally from Colombia, his interest in the stark contrast between Colombia’s natural resource wealth and high levels of inequality, rural violence and deforestation has manifested in feeling a “responsibility to bring research toward action.”"
IRI@AGU: Lessening the Impacts of Climate Shocks to Agriculture,https://iri.columbia.edu/news/iri-agu-lessening-the-impacts-of-climate-shocks-to-agriculture/,Jacquelyn Turner,12/10/18,"In this video, IRI&#8217;s director, Lisa Goddard, discusses two innovations IRI has helped develop to reduce the potential impacts of droughts and extreme weather on vulnerable communities around the world: climate-based index insurance for smallholder farmers in Africa and forecast-based financing for the World Food Programme. Lisa Goddard&#8211; Climate Variability, Index Insurance &amp; Forecast-based Financing [&hellip;]"
IRI@AGU: Farmers&#8217; Perceptions as Data,https://iri.columbia.edu/news/iri-agu-farmer-perceptions-as-data/,Jacquelyn Turner,12/7/18,"As our climate continues to change, it becomes increasingly important to consider the effects this will have around the world, especially in developing countries where many small farmers already struggle. &nbsp;For more than 10 years, researchers at IRI have been developing index insurance, which would provide a safety net for farmers who experience devastating climate [&hellip;]"
IRI@AGU: Schedule of Events 2018,https://iri.columbia.edu/news/iri-agu-schedule-of-events-2018/,IRI,12/6/18,A range of IRI’s areas of expertise will be represented at this year’s annual meeting of the American Geophysical Union (AGU). Below is the schedule of IRI&#8217;s posters and presentations in sequential order. MONDAY Climate Services Research and Development: Adapting to Climate Today Lisa M Goddard is the primary convener for both a presentation and poster [&hellip;]
"After Ten Years of Index Insurance, What&#8217;s Next?",https://iri.columbia.edu/news/after-ten-years-of-index-insurance-whats-next/,Elisabeth Gawthrop,10/16/18,"Despite an overabundance of food in some parts of the world, about 815 million people suffered from chronic undernourishment in 2016. Poor nutrition leads to nearly half of deaths in children under the age of five. Many of those who are hungry are farmers and their families. Our food systems clearly aren’t working as well [&hellip;]"
Upping Our Game: Crop Insurance Project Proves Wildly Successful,https://iri.columbia.edu/news/upping-our-game/,Elisabeth Gawthrop,3/6/18,"A weather index insurance tool is graduating from research project to commercial product. Using multimedia and infographics, a new story puts the technical process in the context of its real-world impact. Find out how the International Research Institute for Climate and Society&#8217;s Financial Instruments Sector team pulled it off, and how the project could be [&hellip;]"
The Big Idea: Farsighted Forecasts,https://iri.columbia.edu/news/the-big-idea-farsighted-forecasts/,David Craig,12/15/17,"Lisa Goddard directs Columbia’s International Research Institute for Climate and Society (IRI), which helps developing countries anticipate and manage the impacts of climate change. Columbia Magazine asked her to explain how climate scientists can predict weather patterns months in advance, and how their work is improving people’s lives. Columbia Magazine: IRI is at the forefront [&hellip;]"
IRI@AGU: Schedule of Events 2017,https://iri.columbia.edu/news/iri-agu-schedule-of-events-2017/,Elisabeth Gawthrop,12/7/17,A range of IRI’s areas of expertise will be represented at this year’s annual meeting of the American Geophysical Union (AGU). One scientist will present on a tool for supporting decision making in agriculture. Another presentation focuses on improving our fundamental ability to predict tropical cyclones. Security under changing conditions is a major theme in [&hellip;]
New Climate Data Transforms Insurance Projects in Africa,https://iri.columbia.edu/news/enacts-transforms-insurance-projects-in-africa/,IRI,4/12/17,"By Dan Osgood, Lead Scientist, IRI Financial Instruments Sector Team Small farms are vulnerable to climate risk, but most smallholder farmers around the world don’t have access to insurance and other financial tools to manage fluctuations in climate. Over the past decade we’ve put a great deal of effort into a new kind of insurance&#8211;index insurance&#8211;that [&hellip;]"
Financial Instruments Sector Team Launches New &#8220;Trade Blog&#8221;,https://iri.columbia.edu/news/financial-instruments-sector-team-launches-new-trade-blog/,IRI,2/16/17,"The Financial Instruments Sector Team has launched a new publication on Medium, called Inside Index Insurance. The purpose of the publication is to provide a range of content types from team members &#8211; from quick dispatches from activities around the world to in-depth analysis of the technical components of financial instruments. &#8220;I&#8217;ve always wanted to know more about what [&hellip;]"
IRI@AGU: Schedule of Events 2016,https://iri.columbia.edu/news/iri-agu-schedule-of-events-2016/,Elisabeth Gawthrop,12/9/16,"A range of IRI’s areas of expertise will be represented at this year’s annual meeting of the American Geophysical Union (AGU). Many of the presentations center on fundamental climate science, including analyses of the influence of climate variability and change on rainfall in the US, Iran, South America and the Sahel, as well as the [&hellip;]"
New Climate Data in Zambia Unlocks Insurance Opportunities,https://iri.columbia.edu/news/new-climate-data-in-zambia-unlocks-insurance-opportunities/,Mélody Braun,11/22/16,"In mid September, IRI staff helped launch an innovative new data platform in Lusaka, Zambia that combines satellite rainfall estimates with the country’s existing network of rain gauges. The platform, developed with the Zambia Meteorological Department and through funding from NASA, is the latest to come out of IRI’s Enhancing National Climate Services (ENACTS) initiative [&hellip;]"
Remote Sensing and Index Insurance: Finding a Common Language,https://iri.columbia.edu/news/remote-sensing-and-index-insurance-finding-a-common-language/,IRI,8/10/16,"by Bristol Powell &amp; Helen Greatrex, Financial Instruments Sector Team   Satellite products could give index insurance projects the scaling power they seek, but challenges remain. A workshop held earlier this year addressed these challenges head on. Index insurance is innovative, but can it reach a critical mass? Until recently, many have doubted that index insurance could scale [&hellip;]"
"25,000 Insured Ethiopian Farmers Receive Payments for El Niño Droughts",https://iri.columbia.edu/news/ethiopiar4drought/,IRI,7/1/16,"By Daniel Osgood More than 25,000 insured farming families in Ethiopia have received payments for crop loss and damages after a year of devastating drought caused in large part by the 2015 El Niño. The farmers purchased the insurance through the R4 Rural Resilience Initiative [latest report], run by the World Food Program and Oxfam America. [&hellip;]"
El Niño 2015 Conference Report,https://iri.columbia.edu/news/el-nino-2015-conference-report/,IRI,4/6/16,"In November 2015, the International Research Institute for Climate and Society at Columbia University, in collaboration with the World Meteorological Organization, the U.S. Agency for International Development and the U.S. National Oceanic and Atmospheric Administration, convened the El Niño 2015 Conference. The report from this conference is now available. In addition to recordings and summaries of the [&hellip;]"
Farmers receive insurance payouts in Senegal,https://iri.columbia.edu/news/farmers-receive-insurance-payouts-in-senegal/,IRI,4/5/16,"In Tambacounda, Senegal, small-scale farmers rely on sufficient and steady rainfall at key times of the growing season. As climate change leads to increased irregularity and intensity of rainfall events, the adaptation strategies employed by farmers to cope with shocks do not always suffice. The fear of poor productivity in a year often prevents them from [&hellip;]"
IRI@AMS 2016: Schedule of Events,https://iri.columbia.edu/news/iriams-2016-schedule-of-events/,Francesco Fiondella,1/8/16,"From crowd-sourcing tornado data to teaching Harlem high-school students about climate change and climate justice, IRI scientists will be sharing a number of fascinating projects at the annual meeting of the American Meteorological Society (AMS) next week in New Orleans.  Below is a schedule of their presentations and posters. Presenting authors appear in bold. Crowd-Sourcing the Storm: A New [&hellip;]"
VIDEO: What tools do Honduran farmers want for climate risk?,https://iri.columbia.edu/news/video-what-tools-do-honduran-farmers-want-for-climate-risk/,IRI,12/17/15,"Text by Sofía Martínez Video by Elisabeth Gawthrop, Sofía Martínez and Courtney St. John Answers from insurance research La version en español esta disponible aquí.  During the first of the two growing seasons of 2015, grain farmers in El Paraíso, Honduras faced one of the worst droughts in history, with losses ranging from 60 to 100% [&hellip;]"
¿Cuáles herramientas quieren los productores hondureños para el riesgo climático?,https://iri.columbia.edu/news/cuales-herramientas-quieren-los-productores-hondurenos-para-el-riesgo-climatico/,IRI,12/17/15,"Texto por Sofía Martínez Video por Elisabeth Gawthrop, Sofía Martínez and Courtney St. John Respuestas de la investigación English version available here.  Durante las dos temporadas agrícolas del 2015, los productores de granos básicos de El Paraíso, Honduras se enfrentaron a una de las peores sequías en la historia, con pérdidas desde un 60 hasta [&hellip;]"
IRI@AGU: Schedule of Events 2015,https://iri.columbia.edu/news/iri-agu-schedule-of-events-2015/,Elisabeth Gawthrop,12/10/15,"The IRI has seven scientists and staff presenting on a wide range of topics at the American Geophysical Union (AGU) Meeting this year. Andrew Robertson and Alexis Berg will present advancements in our fundamental understanding of earth&#8217;s systems. Eunjin Han, Pietro Ceccato and Pradipta Parhi will discuss methods for using our climate knowledge for applications in agriculture, health and [&hellip;]"
Climate Resilience (Animation),https://iri.columbia.edu/news/cr_animation/,IRI,12/5/15,"Climate resilience: it’s the ability for communities to recover from the impacts of climate events. It’s the difference between weather being manageable&#8230;or a catastrophe. But for many parts of the world, where livelihoods depend so much on the climate, critical weather and climate information is unavailable or unusable. The International Research Institute for Climate and [&hellip;]"
IRI @ Climate Week NYC 2015,https://iri.columbia.edu/news/iri-climate-week-nyc-2015/,Francesco Fiondella,9/15/15,"Staff members from the International Research Institute for Climate and Society (IRI) are participating in a number of high-level events during Climate Week NYC  this year. See the schedule below, and follow the links for more information. Launch of the Global Nutrition Report Tuesday, September 22 5:00 pm &#8211; 8:00 pm, Hearst Building, New York Climate change is complicating global efforts [&hellip;]"
VIDEOS: A Host of Visitors,https://iri.columbia.edu/news/videos-a-host-of-visitors/,Elisabeth Gawthrop,3/27/15,"A walk through the International Research Institute for Climate and Society is often punctuated by the sounds of French, Spanish and other languages drifting through the halls. Our international staff contributes to this, but usually it&#8217;s a sign that we are hosting visitors for training and collaborations. Despite the increasing online connectedness of our world, [&hellip;]"
New Study Proves Weather-Based Index Insurance Can Work For Rural Poor on Large Scale,https://iri.columbia.edu/news/new-study-proves-weather-based-index-insurance-can-work-for-rural-poor-on-large-scale/,IRI,1/26/15,"Findings spur Nigerian government to look into solutions to cover 15 million farmers by 2017 LONDON, UNITED KINGDOM (26 January 2015) — Nigerian government officials will convene in London this week to gather advice for scaling-up agricultural insurance policies for smallholder farmers, to bolster the up and coming agricultural powerhouse’s resilience to climate and market shocks. ￼The meeting [&hellip;]"
VIDEO: Designing Insurance with Dominican Dairy Producers,https://iri.columbia.edu/news/designing-insurance-with-dominican-dairy-producers/,Elisabeth Gawthrop,12/19/14,"Over the last year, the financial instruments sector team at IRI has been working in the Dominican Republic to design an index insurance product for the country&#8217;s dairy producers. This work has been part of the Climate Resiliency and Index Insurance Program (CRII), funded by the USAID office in the Dominican Republic. In a new video, we show how researchers [&hellip;]"
IRI@AGU: Schedule of Events,https://iri.columbia.edu/news/iri-agu-schedule-of-events-2014/,Elisabeth Gawthrop,12/8/14,"The IRI has a record thirteen scientists and staff presenting at the American Geophysical Union (AGU) Meeting this year. Below is the schedule of events for those presenting, organized by theme and with links to additional information about their research.  CLIMATE &amp; HEALTH Climate and Population Health Vulnerabilities to Vector-Borne Diseases: Increasing Resilience Under Climate [&hellip;]"
Insurance and Adaptation: Farmer Driven Opportunities (Video),https://iri.columbia.edu/news/insurance-and-adaptation-farmer-driven-opportunities/,Elisabeth Gawthrop,11/12/14,"The Financial Instruments Sector team at the International Research Institute for Climate and Society works with farmers, development organizations and agencies, insurance companies and other research institutes to design insurance products that are tailored to local and regional climate risks and economic systems. With the help of the Center for Research on Environmental Decisions, we&#8217;ve produced this video [&hellip;]"
Climate Week Panel: Building Innovative Index Insurance Markets,https://iri.columbia.edu/news/first-climate-week-panel-to-focus-on-building-innovative-index-insurance-markets-in-developing-countries/,IRI,9/18/14,"First Climate Week Panel To Focus On Building Innovative Index Insurance Markets in Developing Countries NEW YORK, September 18, 2014 — A panel of leaders and experts from the business, humanitarian and research communities will convene this week at the Climate Week NYC to discuss the growing relevance of index insurance as a tool to [&hellip;]"
Join us for Climate Week NYC 2014,https://iri.columbia.edu/news/climate-week-2014-iri-events/,Elisabeth Gawthrop,9/16/14,"The International Research Institute for Climate and Society (IRI) is co-hosting several events during Climate Week NYC 2014. See the schedule of IRI events below, and follow the links for more information. If you are a member of the media and would like to attend any of the events, please write to media @ iri.columbia.edu. Sustaining Health Linking Environment, [&hellip;]"
Drought Insurance for Ganaderos in the Dominican Republic,https://iri.columbia.edu/news/development-of-drought-relief-tools-in-the-northwestern-dominican-republic/,Financial Instruments,8/25/14,"By Sofía Martínez, Radost Stanimirova and Daniel Osgood Since January, the northwestern Dominican Republic has experienced one of the worst droughts in 15 years. Early work by the International Research Institute for Climate and Society and its partners on a project funded by the United States Agency for International Development has shown the potential for using [&hellip;]"
Factsheet: Climate-Resilient Farming,https://iri.columbia.edu/news/climate-resilient-farming/,Francesco Fiondella,8/13/14,"Farmers in Central America and the Caribbean are highly vulnerable to the impacts of a changing and variable climate. Current and projected changes in temperature, precipitation and the frequency of droughts, hurricanes and other extreme events threaten the region&#8217;s ability to meet goals for food security and economic growth. Farmers here typically lack access to timely, [&hellip;]"
Seeing More with Satellites: Improving Insurance for African Farmers,https://iri.columbia.edu/news/seeing-more-with-satellites-improving-insurance-for-african-farmers/,Financial Instruments,8/12/14,"By Bristol Mann and Radost Stanimirova A group of climate scientists, economists and remote sensing experts from the International Research Institute for Climate and Society and NASA’s Goddard Space Flight Center are collaborating to help solve a longstanding issue in the development of agriculture insurance programs in Africa: how to generate enough quality environmental data [&hellip;]"
